{"as_of_date":"2026-08-13","draft_only":true,"locale":"es","no_external_action":true,"privacy_boundary":"identity_free_closed_candidate_response_only","relation":null,"response_state":"selection_required","schema_version":"candidate-gap-response-v1","selected_provider_ordinal":null,"selected_signal":null,"selected_vacancy_ordinal":null,"source_market_snapshot":"snap-market-dossier-v2-sha256-170c3b21b6d2343a35011f7b4bac3f24c8d22a0bf7d3847a300bb14bf8191487","source_provider_research_snapshot":null,"source_research_snapshot":"snap-market-sha256-8273d3c23da3158584005569e48be00cb1a380c4d6d6d15b2c4f8d8464ffb924"}
