{"as_of_date":"2026-08-13","draft_only":true,"locale":"en","no_external_action":true,"privacy_boundary":"identity_free_closed_candidate_response_only","relation":"knowledge_gap","response_state":"complete","schema_version":"candidate-gap-response-v1","selected_provider_ordinal":"L1","selected_signal":"terraform","selected_vacancy_ordinal":"V2","source_market_snapshot":"snap-market-dossier-v2-sha256-e6481fc131e14bd995628acc38e7b0dc5badb13b9d7c405ca5a01ecdfee7df4e","source_provider_research_snapshot":"snap-provider-sha256-1a47017cdf515c2471fa476fedbfa67ca1a9eaf4ff19d8283cd604aa1bf73a31","source_research_snapshot":"snap-market-sha256-018be6ecf73ffb038a260b4c09cdbfa9b6c083a5e42dd06679b80f814b785183"}
