{"as_of_date":"2026-08-13","draft_only":true,"locale":"es","no_external_action":true,"privacy_boundary":"identity_free_closed_candidate_response_only","relation":null,"response_state":"unavailable","schema_version":"candidate-gap-response-v1","selected_provider_ordinal":null,"selected_signal":null,"selected_vacancy_ordinal":null,"source_market_snapshot":"snap-market-dossier-v2-sha256-b8a6838f7259b16c265174d6da2f8d3da7f16df5d510098451233e436c0982bf","source_provider_research_snapshot":null,"source_research_snapshot":"snap-market-sha256-c7b20fd2df65c1ff2861b1db899e661142ea641bd5c270889883fdedac5f22ce"}
